{
  "schema_version": "2.0",
  "word": "bank",
  "pronunciation": [],
  "senses": [
    {
      "sense_id": "financial-institution",
      "pos": "n.",
      "sense_number": 1,
      "english_definition": "an organization that keeps and lends money",
      "chinese_definition": "银行",
      "domain": null,
      "learning_priority": "most_common",
      "confidence": 0.85,
      "source_entry_ids": [
        "0000000000000000000000000000000000000000000000000000000000000000:1"
      ],
      "examples": [],
      "usage_notes": []
    },
    {
      "sense_id": "river-edge",
      "pos": "n.",
      "sense_number": 2,
      "english_definition": "the land along the edge of a river",
      "chinese_definition": "河岸",
      "domain": null,
      "learning_priority": "most_common",
      "confidence": 0.85,
      "source_entry_ids": [
        "0000000000000000000000000000000000000000000000000000000000000000:1"
      ],
      "examples": [],
      "usage_notes": []
    }
  ],
  "morphology": [],
  "exam_tags": [],
  "frequency": {
    "bnc": null,
    "coca": null,
    "frq": null,
    "collins": null,
    "oxford_3000": null
  },
  "provenance": {
    "source": "design_example",
    "source_sha256": "0000000000000000000000000000000000000000000000000000000000000000",
    "raw_entry_ids": [
      "0000000000000000000000000000000000000000000000000000000000000000:1"
    ],
    "ecdict_version": "illustrative-not-source-verified",
    "generator": "phase2-design-fixture",
    "generator_version": "1",
    "prompt_version": null,
    "generated_at": "2026-09-12T00:00:00Z"
  }
}
